{
  "schemaVersion": "1.0.0",
  "modelType": "TABULAR",
  "modelName": "phase2-loan-xgboost",
  "modelVersion": "loan-model-template.v1.0.0",
  "framework": "xgboost",
  "frameworkVersion": "2.1.0",
  "featureSchemaVersion": "phase-2-loan-features.v1.0.0",
  "preprocessingVersion": "preprocess.v1.0.0",
  "trainingDatasetReference": "dataset://synthetic-loans/train/v1",
  "trainingDatasetDigest": "sha256:cccccccccccccccccccccccccccccccccccccccccccccccccccccccccccccccc",
  "evaluationDatasetVersion": "synthetic-loans-eval.v1.0.0",
  "evaluationDatasetDigest": "sha256:dddddddddddddddddddddddddddddddddddddddddddddddddddddddddddddddd",
  "trainingCodeCommit": "0123456789abcdef0123456789abcdef01234567",
  "randomSeed": 42,
  "thresholdVersion": "threshold.v1.0.0",
  "modelBinaryArtifactReference": "minio://models/phase2-loan-xgboost/v1/model.json",
  "artifactDigestAlgorithm": "sha256",
  "modelBinaryArtifactDigest": "sha256:eeeeeeeeeeeeeeeeeeeeeeeeeeeeeeeeeeeeeeeeeeeeeeeeeeeeeeeeeeeeeeee",
  "modelFormat": "xgboost-json",
  "targetDefinition": "repayment within agreed term",
  "scoreSemantics": "higher score means higher repayment likelihood",
  "selectedMetrics": { "primary": "PR_AUC", "guardrail": "RECALL_AT_FIXED_APPROVAL_RISK_THRESHOLD", "calibration": "BRIER_SCORE" },
  "shapExplainerVersion": "shap.v0.46.0",
  "shapExplainerConfig": { "algorithm": "tree", "checkAdditivity": true },
  "pythonVersion": "3.12.4",
  "runtimeImageDigest": "sha256:ffffffffffffffffffffffffffffffffffffffffffffffffffffffffffffffff",
  "manifestPublicationState": "TEMPLATE",
  "platformArchitecture": "linux/arm64",
  "threadCount": 1,
  "deterministicConfig": "single-threaded-predictor",
  "dependencyLockDigest": "sha256:1111111111111111111111111111111111111111111111111111111111111111",
  "license": "Apache-2.0",
  "source": "https://github.com/dlsrnjs125/rippleguard-agent-runtime",
  "createdAt": "2026-07-21T10:05:00+09:00"
}
